[
  {
    "标注基础信息": {
      "来源": "model-teacher",
      "补充": "",
      "年份": "2026",
      "版块1": "Q1",
      "版块2": "Part-A",
      "版块3": "A1"
    },
    "题目信息": {
      "背景信息": "The Earth’s magnetic field can be modeled as a magnetic dipole. In the equatorial plane, the magnetic field is strictly perpendicular to the orbital plane.\nThe magnitude of the magnetic field at a distance $r$ from the Earth's center is given by:\n    $$B(r) = B_0 \\left( \\frac{R_E}{r} \\right)^3$$\n    where $R_E$ is the Earth's radius and $B_0$ is the magnetic field strength at the surface on the equator.\nThe mechanical energy of a circular orbit with radius $r$ for a total mass $M_{tot}$ is $E = -\\frac{G M_E M_{tot}}{2r}$.\nFor any $x \\ll 1$, the approximation $(1+x)^n \\approx 1 + nx$ may be used.\nThe effective emission area of the cathode is $S_{emit} = \\eta S$, where $S$ is the total surface area of the tether and $\\eta$ is a dimensionless factor.",
      "上下文": "# Orbital Decay and Electro-Thermal Equilibrium of an Electrodynamic Tether\nElectrodynamic tethers (EDTs) are long conducting wires used to exchange energy and momentum with a planetary magnetic field. In this problem, we consider an EDT system consisting of two identical small satellites, each of mass $m$, connected by a thin, straight, conductive tether of length $L$ and total resistance $R$. The system orbits the Earth in the equatorial plane at an altitude within the ionosphere. Due to the gravity gradient, the tether is stabilized in a radial orientation, pointing toward the Earth’s center.\n\n**Useful Information:**\n*   The Earth’s magnetic field can be modeled as a magnetic dipole. In the equatorial plane, the magnetic field is strictly perpendicular to the orbital plane.\n*   The magnitude of the magnetic field at a distance $r$ from the Earth's center is given by:\n    $$B(r) = B_0 \\left( \\frac{R_E}{r} \\right)^3$$\n    where $R_E$ is the Earth's radius and $B_0$ is the magnetic field strength at the surface on the equator.\n*   The mechanical energy of a circular orbit with radius $r$ for a total mass $M_{tot}$ is $E = -\\frac{G M_E M_{tot}}{2r}$.\n*   For any $x \\ll 1$, the approximation $(1+x)^n \\approx 1 + nx$ may be used.\n*   The effective emission area of the cathode is $S_{emit} = \\eta S$, where $S$ is the total surface area of the tether and $\\eta$ is a dimensionless factor.\n\n---\n\n---\n\n![](image/model-teacher_2026_1_1.png)\n\n### Part A: Orbital Dynamics and Motional EMF (3.0 points)\n\nConsider the tether system initially moving in a stable circular orbit of radius $r$ ($r \\gg L$) in the Earth’s equatorial plane. The mass of the tether is negligible (take $m_{tether} = 0$), so the two satellites are the only significant masses in the system. The center of mass of the system moves at the Keplerian velocity $v$.",
      "问题原文": "Using a rotating reference frame centered on the system's center of mass, find the expression for the tension $T_N$ at the midpoint of the tether. Use a first-order Taylor expansion in terms of $L/r$ to simplify your result. Express your result in terms of $G$, $M_E$, $m$, $L$, and $r$. **[1.2 pt]**",
      "改造后问题": "Using a rotating reference frame centered on the system's center of mass, find the expression for the tension $T_N$ of the tether. Use a first-order Taylor expansion in terms of $L/r$ to simplify your result. Express your result in terms of $G$, $M_E$, $m$, $L$, and $r$. **[1.2 pt]**",
      "核心思路": "In the rotating frame, the net radial force on a satellite at distance x from the center of mass is the sum of centrifugal and gravitational forces; expanding to first order in x/r gives a linear restoring force, which is balanced by the tether tension.",
      "解答过程": "- **[Physical Principles]**: In a rotating frame centered at the CM (radius $r$) with angular velocity $\\omega = \\sqrt{G M_E / r^3}$, the net radial force on a mass $m$ at distance $x$ from the CM is the sum of the gravitational force, the centrifugal force and the inertial force caused by the acceleration of the CM.\n- **[Equations]**:\n  The effective radial force is:\n  $$F_{eff} = m \\omega^2 (r+x) - \\frac{G M_E m}{(r+x)^2} \\quad (1)$$\n- **[Derivation Steps]**:\n  Using a first-order Taylor expansion for $x \\ll r$:\n  $$F_{eff} \\approx m \\frac{G M_E}{r^3} (r+x) - \\frac{G M_E m}{r^2} \\left(1 - \\frac{2x}{r}\\right) = \\frac{G M_E m}{r^2} \\left(1 + \\frac{x}{r} - 1 + \\frac{2x}{r}\\right) = \\frac{3 G M_E m x}{r^3}$$\n  For the satellite at the outer end ($x = L/2$), the tension $T$ must balance this outward force. Since the tether is massless, the tension $T_N$ at the midpoint is equal to the tension at the ends.\n- **[Final Result]**:\n  $$T_N = \\frac{3 G M_E m L}{2 r^3}$$",
      "最终答案": [
        "$T_N = \\frac{3 G M_E m L}{2 r^3}$"
      ],
      "改造后答案": [
        "$T_N = \\frac{3 G M_E m L}{2 r^3}$"
      ],
      "答案类型": [
        "expression"
      ],
      "改造后答案类型": [
        "expression"
      ],
      "答案单位": [
        ""
      ],
      "改造后答案单位": [
        ""
      ],
      "关联图片路径": [
        "image/IPhO_2025_1_a_1.png"
      ],
      "模态类型": [
        "text+illustration figure"
      ],
      "难度": "medium"
    },
    "条件提取": {
      "显性条件": [
        "Using a rotating reference frame centered on the system's center of mass",
        "Use a first-order Taylor expansion in terms of L/r",
        "Express result in terms of G, M_E, m, L, and r"
      ],
      "隐性条件": [
        {
          "条件原文": "Using a rotating reference frame centered on the system's center of mass",
          "隐藏条件": "The frame rotates with angular velocity ω = sqrt(G M_E / r^3) so that the satellites are stationary in this frame"
        },
        {
          "条件原文": "the tension T_N at the midpoint of the tether",
          "隐藏条件": "The tether is massless, so tension is uniform along its length; T_N equals the tension at the ends"
        },
        {
          "条件原文": "first-order Taylor expansion in terms of L/r",
          "隐藏条件": "L is much smaller than r, so we can expand (r ± L/2)^{-2} to first order"
        }
      ]
    },
    "物理模型": "Two-body system in a rotating reference frame with a massless tether connecting two satellites in circular orbit",
    "关联考点": [
      [
        "Mechanics",
        "Rotational Dynamics",
        "Rotating Reference Frames"
      ],
      [
        "Mechanics",
        "Gravitation",
        "Gravitational Force and Potential"
      ],
      [
        "Mechanics",
        "Kinematics",
        "Taylor Expansion"
      ],
      [
        "Mechanics",
        "Statics",
        "Tension in a Massless String"
      ]
    ],
    "物理场景": "A tethered satellite system in a circular equatorial orbit around Earth, with the tether aligned radially",
    "判分标准": [
      "Award 0.3 pt for setting up effective force equation: F_eff = m ω^2 (r+x) - G M_E m / (r+x)^2",
      "Award 0.4 pt for Taylor expansion: 0.2 for using ω^2 = G M_E / r^3, 0.2 for algebraic expansion to get F_eff = 3 G M_E m x / r^3",
      "Award 0.3 pt for force balance and tension uniformity: substituting x = L/2 and recognizing T_N = F_eff",
      "Award 0.2 pt for final result: T_N = 3 G M_E m L / (2 r^3)"
    ],
    "错误解题步骤": [],
    "多解法标注": []
  },
  {
    "标注基础信息": {
      "来源": "model-teacher",
      "补充": "",
      "年份": "2026",
      "版块1": "Q1",
      "版块2": "Part-A",
      "版块3": "A2"
    },
    "题目信息": {
      "背景信息": "",
      "上下文": "",
      "问题原文": "As the conductive tether cuts through the Earth's magnetic field lines, a motional electromotive force (EMF) is generated between its ends. Calculate the magnitude of this EMF, $\\mathcal{E}$, as a function of $r$, $L$, and the given planetary constants. **[1.0 pt]**",
      "改造后问题": "",
      "核心思路": "Integrate the motional EMF along the tether using v(r') = ω r' and B(r') = B_0 (R_E/r')^3, then substitute ω from Kepler's law to express E in terms of r, L, and planetary constants.",
      "解答过程": "- **[Physical Principles]**: The motional EMF is generated as the tether moves through the magnetic field $B(r)$.\n- **[Equations]**:\n  $$\\mathcal{E} = \\int_{r-L/2}^{r+L/2} v(r') B(r') dr' \\quad (2)$$\n- **[Derivation Steps]**:\n  Substituting $v(r') = \\omega r'$ and $B(r') = B_0 (R_E/r')^3$:\n  $$\\mathcal{E} = \\int_{r-L/2}^{r+L/2} \\omega r' \\frac{B_0 R_E^3}{r'^3} dr' = \\omega B_0 R_E^3 \\left[ -\\frac{1}{r'} \\right]_{r-L/2}^{r+L/2} \\approx \\frac{\\omega B_0 R_E^3 L}{r^2}$$\n  Using $\\omega = \\sqrt{G M_E / r^3}$:\n- **[Final Result]**:\n  $$\\mathcal{E} = B_0 R_E^3 L \\sqrt{\\frac{G M_E}{r^7}}$$",
      "最终答案": [
        "$\\mathcal{E} = B_0 R_E^3 L \\sqrt{\\frac{G M_E}{r^7}}$"
      ],
      "改造后答案": [
        "$\\mathcal{E} = B_0 R_E^3 L \\sqrt{\\frac{G M_E}{r^7}}$"
      ],
      "答案类型": [
        "expression"
      ],
      "改造后答案类型": [
        "expression"
      ],
      "答案单位": [
        ""
      ],
      "改造后答案单位": [
        ""
      ],
      "关联图片路径": [
        ""
      ],
      "模态类型": [
        "text-only"
      ],
      "难度": "easy"
    },
    "条件提取": {
      "显性条件": [
        "Conductive tether cuts through Earth's magnetic field lines",
        "Motional EMF is generated between its ends",
        "Calculate EMF as a function of r, L, and given planetary constants"
      ],
      "隐性条件": [
        {
          "条件原文": "As the conductive tether cuts through the Earth's magnetic field lines",
          "隐藏条件": "The tether is moving relative to the magnetic field, and the magnetic field is not uniform; it varies with distance from Earth."
        },
        {
          "条件原文": "Calculate the magnitude of this EMF, E, as a function of r, L, and the given planetary constants",
          "隐藏条件": "The tether is in a circular orbit with angular velocity ω = sqrt(GM_E/r^3); the magnetic field is a dipole: B(r) = B_0 (R_E/r)^3; the tether length L is much smaller than r (L << r) so that the integral can be approximated."
        }
      ]
    },